id,dialect,description,description_dialect,question1,question2,question3,question4,question5,answer1,answer2,answer3,answer4,answer5,no_answer1,no_answer2,no_answer3,no_answer4,no_answer5
a7976b2383bdddd58b9c96f4337e8b51,Egyptian,"هنا في الصورة توجد واجهة مبنى مدرسة لضعاف السمع مرحلة إعدادي - مهني. اسمها مدرسة عمر بن الخطاب.
وملاصق للمدرسة مبنى سكني على واجهته الجانبية لوحة إعلانية لمعرض أثاث. ومن اسم الشارع المكتوب على اللوحة الإعلانية نلاحظ إن هذا هو أحد شوارع محافظة القاهرة.
وأمام المدرسة مجموعة من الرجال منهم فرد شرطة وموظف وخفير، وخارج المدرسة توجد مجموعة من المواطنين.

من شكل وقفتهم ومن المقاعد المدرسية الموضوعة بالخارج نجد أن هذا هو نفسه المشهد الذي نراه أيام الانتخابات، وبالتالي المدرسة هنا مصورة في  هذا المشهد على أنها لجنة انتخابية.
","فيه هنا في الصورة واجهة مبنى مدرسة لضعاف السمع مرحلة إعدادي- مهني، اسمها مدرسة عمر بن الخطاب.
ولازق في المدرسة عمارة سكنية على واجهتها من الجنب لوحة إعلانية لمعرض موبيليات. ومن اسم الشارع المكتوب اللي على اللوحة الإعلانية بنلاحظ إن ده واحد من شوارع محافظة القاهرة.
وقدام المدرسة مجموعة من الرجالة فيهم فرد شرطة وموظف وغفير، وبره المدرسة فيه مجموعة من المواطنين.

من شكل وقفتهم ومن المقاعد المدرسية المحطوطة بره بنلاقي إن ده هو نفسه المشهد اللي بنشوفه أيام الانتخابات، وبالتالي المدرسة هنا متصورة في المشهد ده على إنها لجنة انتخابية.",إيه اسم الشارع اللي فيه المدرسة؟,إيه تفاصيل اللوحة الإعلانية اللي على معرض الموبيليا بخلاف اسم الشارع؟,ممكن توصفلنا شكل المواطنين، أعمارهم وهدومهم؟,إيه الألوان اللي بتميز شكل المدرسة؟,مبنى المدرسة من كام دور؟, مفيش يافطة عليها اسم الشارع ولا مكتوب على يافطة المدرسة ومش متأكدين أنه نفس اسم الشارع اللي على لوحة الإعلانات,اللوحة لونها أبيض، وطرفها من تحت اللي عليه رقم تليفون فاكس والعنوان لونه أزرق، ومكتوب فوق على الأبيض بالأحمر الذوق الرفيع، وفوقيها بالأخضر الأثاث الراقي، وفوقيها بالأحمر اسم المحل,كلهم رجالة ما بين التلاتين والخمسين، فرد شرطة لابس بنطلون بيج وبلوفر زيتي وكاب الشرطة الزتوني، وجنبه موظف لابس قميص كاروهات بيج وبنطلون أسود قماش ونضارة نظر، وجنبهم راجل شكله خمسيني لابس جلابيه رمادي، وبعد الدكة راجل أربعيني طويل ومليان وبكرش لابس بلوفر كحلي وبنطلون جينز. الناحية التانية شاب تلاتيني تقريبا لابس بنطلون جينز وتيشرت مقلم بيج في برتقالي وعليه جاكت جلد أسود ولابس نضارة شمس سودا، وراه راجل خمسيني شعره رمادي لابس قميص لبني في أبيض كاروهات وبنطلون كحلي., مفيش ألوان بتميزها، اليافطة سودا ومكتوب عليها بالأبيض وسور المدرسة بني محمر اللون العادي لأغلب البنى, تقريبا دورين لانها مش باين إذا كان دا مبنى المدرسة ولا العمارة اللي جنبه,True,False,False,True,True
878457807b2ab2e6b36f8f46821629f8,Egyptian,توضح الصورة مبنى على الطراز الفرعوني، يقف أمامه أربعة أشخاص، رجل يسير في اتجاه وثلاث سيدات تسيرن في الاتجاه العكسي، وعلى يسار الصورة نشاهد سيارة بيجو يبدو أنها سيارة أجرة، وإلى جوارها على الأرض حقيبتا سفر صغيرتا الحجم.,الصورة بتوضح مبنى بتصميم فرعوني، واقف قدمه أربع أشخاص، راجل ماشي في اتجاه وتلات ستات ماشيين في الاتجاه العكسي، وعلى الشمال عربية بيجو باين إنها تاكسي وجنبها على الأرض شنطتين سفر صغيرين.,واضح في الصورة المبني دة مؤسسة ولا مبنى سكني؟ ,البيجو دي سبعة راكب ولا اربعة عادي؟,من أرقام العربية البيجو تقدر تقول الصورة دي متصورة فين؟ ,العربية البيجو دي لونها ايه؟,شنطتين السفر دول بتوع مين؟ ,المبنى واضح أنه محطة القطر,بيجو سبعة راكب، لأنها طويلة,الصورة في أسوان لان محطة القطر عليها يافطة مكتوب عليها أسوان، أرقام العربية البيجو مش ظاهرة اصلا,عربية بيضا فيها خط أحمر في النص, مش باين لأن مفيش حد واقف جنبهم، الستات والراجل والعربية على مسافة منهم,False,False,False,False,True
eb794e837936619dd092359615fede8e,Egyptian,يظهر في الصورة قطار قديم الطراز باللونين الأزرق والأزرق السماوي وعلى متنه زحام شديد من الركاب ولا باب له من الأساس وثمة شاب يجلس مكان الباب وهناك شاب آخر يحاول صعود القطار ويساعده أحد الركاب على الصعود ويظهر رقم القطار على العربة 15691.,الصورة لقطر أزرق في لبني شكله قديم وفي جواه زحمة جدا والباب مش موجود أصلا وفيه واحد قاعد الأرض مكان الباب وواحد بيحاول يطلع القطر وفي واحد تاني واقف فوق بيشده عشان يطلع ومكتوب رقم القطر 15691.,الصورة في الصيف ولا الشتا ولا أنهي فصل؟,الصورة الصبح ولا بالليل ؟,ايه شكل الناس في القطر وايه لبسهم؟,القطر بيتحرك ولا واقف ؟,ايه شكل رصيف المحطة اللي فيها القطر؟,ممكن يكون فصل الصيف أو فصل الخريف، دا لإن بعض الركاب لابسين تيشرتات نص كم، وبعضهم لابس قمصان بكم طويل، والولد اللي متشعبط في القطر لابس تيشرت خريفي، وفصل الخريف في مصر بيتميز بأن حرارته أقل شوية من الصيف والريح بتبقى قليلة عكس بلدان تانية.,الصبح، دا لإن مفيش أثر لإضاءة ليليلة والباب التاني بتاع القطر اللي باين في الخلفية ظاهر منه إضاءة نهارية موضحة المبنى اللي وراه، وفي ضل خفيف باين على القطر زي الظل بتاع وقت النهار.,الولد اللي متشعبط في القطر لابس تيشرت خريفي أحمر وبنطلون جينز أزرق، والشاب اللي بيشده لابس قميص كروهات، والشاب اللي قاعد في مدخل البوابة لابس قميص مخطط غامق.,القطر واقف وعلى وشك إنه يتحرك., الرصيف مش باين في الصورة.,False,False,False,False,True
d9c79442b5065d502433ca69eda9e9e6,Egyptian,هذه صورة لطائرة ركاب تشق عنان السماء، تتميز بلونها الأبيض وشريط أحمر طولي في المنتصف يمتد من كابينة القيادة وحتى ذيل الطائرة، مكتوب عليه اسم شركة الطيران بخط صغير للغاية، والسماء من حول الطائرة صافية عدا بعض السحب البيضاء القليلة.,الصورة بتوضح طيارة ركاب بتشق السما، ولونها أبيض وفي الوسط شريط أحمر بالطول واخد من كابينة القيادة للديل، واسم شركة الطيران مكتوب على الشريط الأحمر بخط صغير ومش واضح، والسما حوالين الطيارة صافية ما عدا شوية سحب بسيطة لونها أبيض، ,ديل الطيارة لونه ايه ؟,ايه شكل شبابيك الطيارة مربع ولا مدور ولا حاجة تانية؟,الطيارة لسه نازل منها العجل ولا اترفع؟,هل في أي حاجة تانية في الخلفية باينة زي بيوت أو زرع؟,في أي حاجة تانية بتطير في السما طيارات أو طيور؟,الديل لونه أبيض وعليه شريطين لونهم أحمر واسود., شبابيك الطيارة مش باينة في الصورة.,العجل لسة نازل من الطيارة.,مش باين أي حاجة غير الطيارة والسما.,الصورة مش موضحة غير الطيارة بس.,False,True,False,False,False
56dd681529247f4ef2977a43ae937ea0,Egyptian,"تم التقاط الصورة في مصر ومن الواضح أنه تم التقاطها منذ مدة كبيرة، إذ تظهر العديد من سيارات الفيات القديمة وكذلك ألواح ترخيص هذه السيارات مكتوب عليها ""ملاكي"" وقد تم إلغاء هذه الألواح. ثمة ثلاث سيارات على اليسار واثنتين على اليمين. ويظهر على إحدى الافتات أيضا اسم شركة ""موبينيل"" وهو الاسم القديم لشركة ""أورانج"" حاليًا. الشارح نظيف وفارغ إلى حد كبير ويوجد ما يقارب 15 من المشاء في الصورة.","الصورة متصورة في مصر وواضح إنها متصورة من فترة كبيرة، لأن في عربيات كتير فيات وحاطة اللوح اللي اتلغت ومكتوب عليه ""ملاكي "". في تلت عربيات راكنة على الشمال وعربيتين راكنين على اليمين. وكمان اسم شركة ""موبينيل"" موجود علي يافطة واحدة من العماير، ودا الاسم القديم لشركة ""أورانج"" حاليا. الشارع نظيف وفاضي إلى حد كبير وفي حوالي خمستاشر شخص ماشيين في الصورة.",الصورة متصورة الصبح ولا بالليل؟,واضح من لوح العربيات احنا في أنهي محافظة ومدينة؟,ايه أشكال الناس في الصورة وايه تعابير وشهم؟,في أي محلات تانية في الشارع أو في أي يفط تانية؟,ايه ألوان العماير والعربيات ولبس الناس؟,الصورة متصورة الصبح ونور الشمس واضح.,لأ، مش باين اسم المحافظة من يافطة العربية., الناس باينة في الصورة من بعيد؛ فصعب تبان ملامحهم أو تعبيرات وشهم، بس في شاب على الشمال حاطط إيده في جيبه وبيتمشى بهدوء كأنه بيتأمل الشارع.,في يافطة فودافون متعلقة على تالت بيت على اليمين، ومحل جنب العربية اللي راكنة على اليمين، ويافطة صفرا مكتوب عليها باكين فوق المحل، وعلى الشمال في أربع يفط متعلقين على رابع عمارة مش باين مكتوب فيهم إيه، وممكن تكون يفط لعيادات دكاترة أو مكاتب محامين لإنها متعلقة على أدوار علوية.,أغلب العمارات لونها بيج أو أحمر طوبي فاتح، وأغلب الناس لبسها مش باين في الصورة، بس في شاب على الشمال لابس تيشرت أبيض بلون اسود على الكمام النص وبنطلون جينز، ووراه ست محجبة لابسة بلوزة خضرا وبنطلون قماش زيتي، وفي راجل لابس جلابية بيضا وعمامة بيضا، وعلى اليمين في راجل قاعد على الرصيف تحت كابينة تليفونات لابس جلابية سودا.,False,False,True,False,False
eafe0c377a991c59478a94cf55438d95,Egyptian,صالة انتظار بأحد المطارات، عدد من الركاب ينتظرون على المقاعد المعدنية، وبجانب بعضهم حقائب للسفر. هناك شاشة تلفاز مغلقة، ولافتة خضراء مضيئة تشير إلى مخرج الطوارى، ولافتة أخرى مكتوب عليها ممنوع التدخين.,صالة انتظار في مطار، في كنب كتير عليه ناس مستنية، رجالة وستات، ملابس مختلفة، جنبهم شنط سفر بس مش كتير وفي شاشة تلفزيون مقفولة، ويافطة خضرا منورة بتشاور على مخرج الطوارى ويافطة تانية مكتوب عليها ممنوع التدخين,عدد الناس حوالي قد ايه بالتقريب؟,الصورة متصورة الصبح ولا بليل؟,هل المطار شكله منظم ولا في عشوائية؟,الناس دي شكلهم ايه مصريين ولا أجانب؟,هل في حد من الموظفين في المطار ظاهر ولا كلهم مسافرين؟,عددهم حوالي تلاتة وعشرين فرد., صعب تحديد دا؛ لإن المكان مقفول، حتى الساعة اللي باين عليها الوقت مش محدِدة دا توقيت صباحي واللا مسائي.,المطار شكله منظم، والناس قاعدين في صالة الانتظار بهدوء مستنيين مواعيدهم.,في منهم مصريين ومنهم أجانب.,مفيش موظفين باينين في الصورة.,False,True,False,False,False
30aa94616f8edbbe36815cf6906ce150,Egyptian,"ست سيارات من نوع ""بيچو سبعة راكب"" لونهم أبيض وأزرق -لون سيارات الأجرة في دمياط- رُكنوا جميعا إلى جانب الطريق أمام اوتوبيس سياحي وإلى جوارهم حواجز حديدية تشبه تلك الخاصة بالمرور، السماء صافية والصورة التُقطت صباحا.",ست عربيات بيجو سبعة راكب لونهم أبيض في أزرق -لون التاكسي في دمياط- راكنين على جنب الطريق وراهم اوتوبيس سياحي، وجنبهم حواجز حديدية شبه الحواجز بتاع المرور والصورة بالنهار والسما صافية.,شكل الأتوبيس السياحي عامل اذاي وإيه ألوانه؟,هل باين في الصورة أي حد معدي على رجليه في الشارع؟,سواقين العربيات البيجو باينين في الصورة واللا لأ؟,هل باين من الصورة أي شخص من ركاب الأتوبيس؟,إيه شكل عسكري المرور اللي واقف عند الحواجز؟,"أتوبيس لونه أبيض في ضهره لون أحمر، وفي خطوط قليلة بالأحمر وخط أزرق واحد ومكتوب اسم شركة السياحة بالأحمر ""HEPTON"" وجنبها نجمة",لا الأشخاص الوحيدة في الصورة واقفين عند الكشك,لا مش باينيين غير في عربية واحدة, انعكاس الشمس على الإزاز مش مبين حد جوا الأتوبيس, مش باين لكن شكله أسمر ولابس بدلة ضباط سودا,False,False,False,True,True
35adade9c65e7bfc4e91e9cb7d1e0918,Egyptian,"""طفطف"" يسير في ملاهي حديقة الأسرة وسط الكثير من الأشجار، الوقت نهار والسماء صافية لا يشوبها إلا القليل من السُحب، يظهر من الظل أن الشمس في مواجهة ""الطفطف"" خلف مَن يلتقط الصورة، وفي مقدمته وبزاوية جانبية تظهر صورة للملكة نفرتيتي.",طفطف في ملاهي حديقة الأسرة، ماشي وسط شجر وخُضرة والجو نهار والسما صافية وفيها شوية سُحب خفيفة ومن الضل الشمس في مواجهة الطفطف ورا اللي بيلقط الصورة، وعلى أول الطفطف من الجنب فيه صورة للملكة نفرتيتي.,مين الناس اللي راكبين في الطفطف؟,هل في حيوانات ظاهرة في الصورة؟,ايه تعبيرات وش الناس اللي في الطفطف؟,هل في حاجة بتقول إن دي حديقة الأسرة؟,إيه لون الطفطف اللي في الصورة؟, محدش من ركاب الطفطف واضحين,لا مفيش حيوانات ظاهرة في الصورة, وشوش الناس مش ظاهرة من على بعد,لا، مفيش علامة مميزة ممكن يكون شكل الطفطف لو معروف,لونه أصفر، ومقدمة الطفطف سودا,True,False,True,False,False
dda45bafde101a430d87566dde5bcc6d,Egyptian,"صورة التُقِطَت في الصباح الباكر لدير القديس الأنبا أنطونيوس، في منطقة صحراوية معزولة. الدير يمتد بعرض الصورة وتظهر يافطتان عليهما الاسم بالعربية والإنجليزية. في الخلفية تظهر الصحراء على امتداد البصر حتى تصل إلى السماء ذات اللون الأزرق الفاتح. أمام الدير، يوجد حافلتان كبيرتان لونهما أزرق وأبيض، مكتوب عليهما ""لاكوست للسياحة""، وخلفهما ميني باص أصغر باللون الأبيض. الدير مقسم إلى عدة مبانٍ، حوالي تسعة. الثلاثة الأمامية تحتوي على عدة قباب مستديرة بجانب بعضها البعض، وتحتوي على نوافذ دائرية. خلفها توجد مبانٍ مستطيلة بدون قباب. على يسار الصورة، أمام الدير، توجد استراحة دائرية بمقاعد مبنية من الطوب وسقفها مصنوع من الخوص، يجلس فيها بعض الأشخاص. أمام مداخل الدير، توجد مظلات من الخوص لتوفير الظل. على يمين الصورة، عند طرف المظلة المصنوعة من الخوص، يظهر رجلان يسيران بالقرب من بعضهما، أحدهما يرتدي قميصًا أبيض بنصف كم، مما يشير إلى أن الصورة قد تكون في الصيف. توجد استراحة أخرى على اليمين، أمام الدير بقليل، لكنها ليست ظاهرة بالكامل، ويجلس فيها شخص. الساحة أمام الدير مقسمة بين الرمل والأسفلت، وعلى أطراف المنطقة الرملية توجد أشجار قصيرة متباعدة. في مفترق الطرق على الأسفلت تظهر امرأتان تفصلهما مسافة صغيرة، ترتديان بنطلونات وبلوزات، وتتجهان نحو الدير.
",صورة الصبح بدري لدير القديس الأنبا أنطونيوس، في مكان صحراوي معزول. الدير واخد عرض الصورة وعليه يافطيتين باسم الدير عربي وانجليزي. في الخلفيه صحرا على امتداد البصر لحد السما اللبني. قدام الدير في أتوبيسين سفر كبار راكنين لونهم أزرق في أبيض مكتوب عليهم لاكوست للسياحة ووراهم ميني باص أصغر أبيض راكن. الدير متقسم لأكتر من مبنى، حوالي 9. التلاتة اللي قدام ليهم كذا قبة مدورين جنب بعض وفيهم شبابيك مدورة. ووراهم مباني مستطيلة من غير قبب. على شمال الصورة قدام الدير في استراحة مدورة كنبها طوب مبني وسقفها من الخوص، وقاعد فيها ناس.  وقدام  مداخل الدير في تاندات من الخوص للضل. على يمين الصورة وعند طرف التاندة الخوص في اتنين رجالة ماشيين قريب من بعض واحد منهم لابس قميص أبيض نص كم يعني احنا في الصيف في الأغلب. في استراحة تانية على اليمين قدام الدير بشويتين مش باينة كلها لكن فيها شخص. الساحة قدام الدير متقسمة رمل وأسفلت، وعلى حروف الرمل في شجر قصير بينه مسافات. في نص الرصيف في اتنين ستات بينهم مسافة صغيرة لابسين بنطلونات وبلوزات رايحين ناحية الدير.,فين موقع الرصيف اللي عليه اتنين ستات من الدير في الصورة؟,عمر الرجالة اللي في الصورة أد ايه؟,الشخص اللي قاعد في الاستراحة لابس ايه؟,هل في أبواب على مداخل الدير سواء مفتوحة أو مغلقة؟,الاتنين الستات لون لبسهم ايه؟,الستات موجودين قبل ساحة الانتظار  الكبيرة اللي فيها الأوتوبيسات وقبل البوابة بتاعة الدير. , صعب تحديد أعمارهم لإنهم باينين في الصورة من بعيد., صعب تحديد لبسه؛ لإنه باين في الصورة من بعيد.,غالباً البوابة موجودة تحت اليافطتين الكبار، بس الأتوبيس مداري عليها، بدليل الناس اللي خارجة منها والناس اللي متجهين ليها.,الست اللي على اليمين لابسة بلوزة زرقا وبنطلون اسود، والست اللي على الشمال لابسة بلوزة سودا، والبنطلون لونه مش ظاهر أوي لكنه في الغالب رمادي.,False,True,True,False,False
38e14901c9d3493e9437c7d5ac79749c,Egyptian,تم التقاط الصورة في إحدى المناطق السياحية وتعرض سائحًا يحمل شالًا أبيض على الأرجح ويحاور البائع وخلفهما متجر يضم تشكيلة من ملابس السيدات من جلابيب ترتديها دمى عرض الملابس وقمصان معلقة على واجهة المتجر وثمة قسم يضم كوفيات وشيلان.  ,الصورة في منطقة سياحية فيها محلات لبيع الملابس وفي سايح واقف مع بياع وماسك شال أبيض تقريبا وبيكلمه وفي الخلفية في هدوم ستات وهي جلابيات لابسها مانيكان وتيشرتات متعلقة على واجهة المحل وكمان في جزء فيه كوفيات وشيلان.,هل باين احنا الصبح ولا بالليل؟,هل باين المنطقة السياحية في القاهرة ولا مدينة ساحلية؟,السايح والبياع لابسين ايه وايه لون لبسهم؟,ايه اسم المحل ولونه وديكوره؟,ايه ألوان اللبس اللي على الماليكان؟,الصورة متصورة بالنهار ونور الشمس واضح., صعب تحديد دا، لإنها ممكن تكون متصورة في مكان مفتوح في القاهرة زي الأهرامات، أو في مكان ساحلي.,البياع لابس جلابية رصاصي ولافف على كتفه لاسة بيضا، والسايح لابس كاب بني وتيشرت رمادي وشورت جينز.,"في يافطة متعلقة على المحل من فوق باين عليها الحروف الأخيرة من كلمة ""نفرتيتي"" وجنبها صورة لتمثال نفرتيتي، والمحل نفسه لونه وردي، تصميمه بسيط جداً ومفيهوش أي ديكورات.",في صف مانيكانات على الشمال لابسين جلابيات بألوان مختلفة (أزرق خفيف، وردي، أبيض وبنفسجي مايل للأحمر)، وصف مانيكانات متعلق فوق لابسين فساتين ألوانها (أخضر بترولي، بنفسجي، وردي ودهبي)، دا غير صف المانيكانات اللي تحت ولابسين حاجة شبه بدل رقص متحزمة من النص بألوان ما بين الأزرق والرصاصي اللامع والأبيض والبمبي، وقدامهم اتنين مانيكان واحد ببلوزة زرقا وبنطلون وردي والتاني ببلوزة وردي في أزرق.,False,True,False,False,False
