id,dialect,description,description_dialect,question1,question2,question3,question4,question5,answer1,answer2,answer3,answer4,answer5,no_answer1,no_answer2,no_answer3,no_answer4,no_answer5
205f2adb8c9583f3236cc827a264e3a1,Egyptian,قطعة من الخيش القديمة مقطوعة وفي حالة مزرية، ربما خرقة. الخرقة مقطوعة من الأعلى ومن الأسفل، والبعض من المنتصف. لون الخرقة أصفر باهت وبها ثلاث خطوط زرقاء بطول الخرقة. الخرقة مفروشة على أرض سوداء تماما ومسلط عليها إضاءة ساطعة من الأعلى.,حتة خيش قديمة ومقطعة ومبهدلة يعني خرقة تقريبا. الخرقة مقطوعة من فوق ومن تحت، وشوية نئر من النص. الخرقة لونها أصفر باهت وفيها تلات خطوط زرق بالطول. الحتة مفروشة على أرض سودا متنور عليها نور جامد من فوق.,الخرقة دى مستطيلة ولا مربعة ؟,قطعة الخيش دى شكلها حتة من ملابس ؟,حتة الخيش باين من شكلها كانت بتستخدم فى المسح ؟,الأرض السودا دى بلاط ولا سيراميك ولإيه؟,النور إلى على الخرقة لونه إيه؟, مش باين ليها أبعاد من كتر القطع, مفيش جيت أو كم فيها ومش واضح إذا كانت لبس ولا لا, حتة الخيش شكلها ناشفة ومفرودة فمش واضح استخدامها,الأرض لا بلاط ولا سيراميك هي خلفية سودا,النور على الخرقة لونه أبيض,True,True,True,False,False
808d0796447e3af521e12dc4c26decad,Egyptian,صورة ملتقطة من الأرض لمسلة عالية تحمل نقوشًا هيروغليفية، وتقف المسلة على قاعدة مربعة مزخرفة بنقوش وتماثيل. خلف المسلة، يظهر مبنى يشبه المعبد ويتواجد به تماثيل كبيرة الحجم. يوجد أشخاص يمشون في الممر. الصورة التُقطت في النهار، والسماء زرقاء.,صورة متصورة من على الأرض لمسلة عالية عليها نقوشات هيروغليفية، والمسلة على قاعدة مربعة عليها نقوشات وتماثيل. ورا المسلة في مبنى تقريبا معبد وتماثيل بأحجام كبيرة. في ناس ماشيين في الممر. الصورة بالنهار والسما زرقا.,كام تمثال ظاهر فى الصورة ؟,الناس إلى ماشية فى منهم سياح ولا مصريين ؟,ظاهر فى الصورة أى إشارات تدل على المكان ده إيه وفين ؟,إيه إلى موجود على يمين وعلى شمال الصورة ؟,الأرض رملية ولا حجرية ؟,في تمثالين كبار وفي أربع تماثيل صغيرة على مقعد منصة,الناس اللي ماشيه في منهم سياح ومصريين, مفيش إشارة واضحة لكن هو معبد في الأقصر أو أسوان,يمين الصورة معبد وممر فيه ناس بتمشي، وعلى الشمال باقي المعبد اللي قدامه واحد من التمثالين الكبار,الأرض نصين، النص على اليمين الممر حجارة ممهدة للمشي، والنص الشمال صخور صغيرة أوي وزلط,False,False,True,False,False
be6803f925862c986c5b9030e6f4dfd5,Egyptian,"صورة لمجموعة من الأشخاص يجلسون في قاعة للندوات. يركز الحضور على امرأة واقفة على المنصة تتحدث في ميكروفون، أمامها طاولة كبيرة مصنوعة من الخشب تحتوي على العديد من الملفات وجهاز لابتوب. خلف السيدة، على الجدار الخشبي، يوجد بوستر أبيض مكتوب عليه ""مؤتمر برنامج للتعليم""، بينما باقي النص غير واضح، ويحتوي على عدة شعارات. على اليمين، توجد شاشة عرض كبيرة بيضاء، وخلفها جهاز تكييف طويل. على اليسار، الباب مفتوح، ويقف شخص متكئ على الباب. القاعة مزودة بعدد كبير من المصابيح المعلقة، وجميعها مضاءة باللون الأبيض.",صورة لناس كتير قاعدين في قاعة ندوات. الناس باصين على واحدة واقفة على المنصة بتتكلم في مايك وقدامها ترابيزة كبيرة خشب عليها دوسيهات كتير ولابتوب. ورا الست على الحيطة الخشب بوستر أبيض مكتوب عليه مؤتمر برنامج للتعليم وباقي الكلام مش واضح وعليه كذا لوجو. على اليمين في شاشة عرض بيضا كبيرة ووراها تكييف طويل. على الشمال باب القاعة مفتوح وواقف واحد ساند على الباب. القاعة فيها لمض كتير فوق وكلها منورة أبيض.,الناس اللي قاعدين رجالو ولا ستات؟,الناس اللي قاعدة في سن الشباب الصغير؟,الناس اللي قاعدة لابسة صيفي ولا شتوي؟,الكراسي في القاعة شكلها ولونها ايه؟,القاعة متقسمة كراسي يمين وشمال بينهم ممر ولا كل الكراسي صفوف كاملة؟,الناس اللي قاعدين رجالة وستات,الناس اللي قاعدة أعمارها من الشباب لحد الأربعين,الناس اللي قاعدة لابسه شتوي,الكراسي اللي في القاعة مبطنة لونها أخضر وضهرها أسود, الصورة من ورا الكراسي اللي في النص مش مبينة الجناب في بينها ممر ولا لا,False,False,False,False,True
1e2b29ba156a5c008fb3c15339d1d008,Egyptian,صورة لقطة بلدية لونها أبيض مع أسود. القطة نائمة وأقدامها وأيديها ملتفة بشكل قوسي. القطة مستلقية على أرض حديقة مغطاة بنباتات خضراء وصفراء. القطة نائمة بجانب شجرة، بالقرب من جذع الشجرة. الصورة تم التقاطها في النهار والإضاءة ناتجة عن ضوء الشمس.,صورة لقطة بلدي لونها أبيض في أسود. القطة نايمةوإيديها ورجليها قافلاهم زي القوس. القطة على أرض جنينة عليها زرع أخضر في أصفر. القطة نايمة جنب شجرة وجذع شجرة. الصورة بالنهار والإضاءة من نور الشمس. ,دي قطة كبيرة واللا قطة صغيرة؟,"القطة شكلها هزيل ولا صحتها حلوة؟
",الزرع اللي في الجنينة نجيلة واللا حاجة تانية؟,الجذع اللي جنب الشجرة دا عبارة عن شجرة مقطوعة؟,الصورة شكلها في جنينة ولا ديه الشجرة ديه في الشارع؟,قطة كبيرة بمعنى أنها مش لسه مولودة,القطة شكلها صحتها حلوة كويسة,الزرع اللي في الجنينة شكله نجيلة وعشب, لا، ومش باين هو ايه, الصورة قريبة جدا من جذع الشجرة والقطة مش باين باقي تفاصيل المكان,False,False,False,True,True
5d056f80122f7c53b5235d5a2d1e7e94,Egyptian,"يظهر في الصورة الجزء السفلي لأحد أهرامات الجيزة الثلاثة، وفي الجانب الأيمن تقف أربع حافلات تبدو بالغة القدم، وأمام الهرم ثمة كثير من الأحصنة والجمال في مشهد عشوائي ومزعج للعين، ويوجد كثير من الرجال الذين يرتدون جلابيب واقفين بالقرب من الحيوانات، ومن الواضح أنهم مربوها، وقد وضعوا عليها سروجًا مزينة بأقمشة حمراء تدلى منها لجذب السياح، وثمة أرقام في أسفل الجانب الأيمن، وهي ""88 7 13""، ويبدو أنها تاريخ التقاط الصورة.","الصورة للجزء اللي تحت لواحد من أهرامات الجيزة التلاتة، وعلى اليمين في أربع أتوبيسات شكلهم قديم جدا، وقدام الهرم في حصنة كتير جدا وجمال موجودة بشكل عشوائي ومزعج للعين، وفي رجالة كتير لابسين جلاليب واقفين جنب الحيوانات وواضح انهم صحابها، وملبسينها سروج متزينة بقماش أحمر مدلدل عشان تجذب السياح، ومكتوب أرقام شكلها تاريخ تصوير الصورة ""88 7 13""  تحت على اليمين.",الصورة متصورة بالنهار ولا بالليل؟,الأتوبيسات القديمة ألونها ايه ؟,في حوالي كام جمل وحصان في الصورة؟,الرجالة اللي لابسين جلاليب تعابير وشهم ايه في الصورة؟,الأتوبيسات القديمة مش مكتوب عليها أي حاجة؟,الصورة متصورة بالنهار مش بليل.,في اتوبيسين لونهم من فوق أبيض ومن تحت عند العجل خط أزرق فوقيه خطين حمر، واتوبيس أبيض بخطين حمر بس، واتوبيس تركواز أو أزرق قريب من الجراي فيه خطوط حمرا.,ممكن حوالي 5 جمال و20 حصان أو حمار., مفيش حد تعبير وشه ظاهر في الصورة.,اه الاتوبيسات مش مكتوب عليها أي حاجة.,False,False,False,True,False
5dfb99d1dbb939a0feefec0a435b0f70,Egyptian,صورة ليدَي رجل بائع يقوم بتقديم الطعام من طبق كبير معدني موضوع داخل شئ حديدي كبير إلى طبق صغير جداً. يبدو أن هناك لافتة معلقة على الحديد تحمل اسماً أو سعراً، لكنها غير واضحة. يقف وراء الرجل بائع آخر غير واضح ملامحه، ويبدو أن المكان عبارة عن متجر في سوق أو عربة في شارع مزدحم بالسوق.,صورة لايدين راجل بياع بيغرف من طبق كبير معدني محطوط في حاجة حديد كبيرة جاندوفلي في طبق صغير أوي. واضح أن الحديد متعلق عليه يافطة عليها اسم او سعر لكن مش واضحة. الراجل وراه راجل تاني مش باين وشكلهم في محل في سوق أو في الشارع في السوق.,إيدين الراجل تدى شكل أنه كبير فى السن ولا صغير ولونها إيه ؟,باين في الصورة الراجل لابس إيه ؟,الصورة متصورة بالليل ولا بالنهار ؟,شكل اليافطة إلى مكتوب عليها إيه ؟,الطبق الصغير ده طبق فوم ولا معدن ؟,ايدين لراجل في متوسط العمر أربعينات يعني، ولونها قمحي مسمر,باين في الصورة إن الراجل لابس حاجة بكم بيضا، لكن مش باين إذا كان قميص ولا جلابية, الصورة جوا محل متنورة بنور المحل ومش باين الوقت من اليوم,اليافطة خشب لونها أحمر وأطرافها صفرا والكتابة عليها بيضا,الطبق الصغير دا ميلامين لونه سيمون,False,False,True,False,False
5b892794da0fa2acfec1f8739f276e1f,Egyptian,"صورة لجلسة رسمية في قاعة بقصر الاتحادية، حيث يجلس الرئيس السيسي مرتديًا بدلة كحلية، مبتسمًا على كرسي مذهب. على جانبيه توجد طاولتان مذهبتان مزودتان بالرخام، وفي الخلفية علم مصر الكبير، بينما معلق على الحائط خريطة كبيرة لمصر باللون البيج، مكتوب عليها ""خريطة القطر المصري"". إلى يسار الصورة يوجد نافذة كبيرة مزخرفة برسوم ملونة، يتسلل منها ضوء الشمس. أمام الرئيس يجلس رجل وامرأتان مرتدون ملابس رسمية على كراسي مذهبة أيضًا، وفوق الطاولات أمامهم نفس التصميم المذهب والرخامي. الأرض مغطاة بسجادة كبيرة باللون البيج مزخرفة بنقوش ملونة بالذهبي والأزرق.",صورة للقاء رسمي في قاعة في قصر الاتحادية في الأغلب. في الوش قاعد الرئيس السيسي لابس بدلة كحلي ومبتسم على كرسي مدهب وجنبه على الناحيتين ترابيزتين مدهبين عليهم رخام، ووراه علم مصر كبير وعلى الحيطة متعلق خريطة مصر كبيرة باللون البيج ومكتوب عليها خريطة القطر المصري. على شمال الصورة شباك كبير عليه رسومات ملونة وداخل منه نور الشمس. وقاعد قدامه راجل واتنين ستات لابسين رسمي قاعدين على كراسي مدهبة برضه وقدامهم ترابيزات نفس الشكل مدهب ورخام. الأرض عليها سجادة بيج كبيرة وعليها نقوشات ملونة دهبي في أزرق.,تعبيرات وش الراجل والاتنين ستات إيه   ؟,فى مصورين باينين فى الصورة ؟,المكان كله منور بلشمس ولا فى إضاءة فى المكان نفسه ؟,كان فى حاجات محطوطة على الطرابيزات ؟,كان فى أى تحف موجودة فى المكان ؟,الراجل مبتسم ابتسامة خفيفة والاتنين ستات باصين بتركيز,لا مفيش أي مصورين باينين في الصورة, مش واضح أي لمض أو مصدر إضاءة تاني غير الشباك الإزاز لكن مش هو اللي منور القاعة كلها,محطوط حاجات زي أطباق فضة ليها غطيان وجنبها علب خشب لونها بني للمناديل,مفيش غير حاجة رخام طويلة لونها أخضر وعليها نقوش دهبي,False,False,True,False,False
cc338b8541edb8a88d858ed668bcecf5,Egyptian,صورة لطريق أسفلتي خالٍ، يتواجد فيه سيارة واحدة فقط. الطريق مقسوم إلى قسمين؛ الجزء الأيسر يطل على نهر النيل، ويوجد فوقه جسر، بينما الجزء الأيمن يؤدي إلى داخل المدينة. على اليمين، توجد عمارات مبنية من الطوب الأحمر، بعضها مطلي باللون الأبيض، بالإضافة إلى أشجار النخيل. الرصيف لونه أسود مع خطوط صفراء. أمام النيل، يوجد سور حديدي أسود، وخلفه دكك خشبية بيضاء. كما توجد مجموعة من الأشخاص واقفين على الرصيف أمام النيل.,صورة لطريق أسفلت فاضي فيه عربية واحدة بس. الطريق مقسوم اتنين النص الشمال على النيل وفوقيه كبري. والنص اليمين طريق بيدخل لجوا المدينة. على اليمين في عمارات على الطوب الأحمر وفي منها لونه أبيض. وفي نخل. الرصيف لونه أسود في في أصفر. قدام النيل في سور حديد أسود ووراه دكك خشب بيضا. في ناس واقفة على الرصيف قدام النيل.,العربية دي ايه اللي ظاهر منها بالظبط؟,العربية اللي في الصورة نوعها ايه؟,هل في أي يفط ظاهرة في الصورة لمحلات أو في الشارع عموما؟,السور الحديد دا مفرغ ولا حتة واحدة؟,الطريق شكله نضيف ومرصوف وخطوطه واضحة ولا ايه؟,العربية ظاهر معظمها من وشها ماعدا جزء من الجنب الشمال, مش باين نوعها لأنها بعيدة ومهزوزة,لا مفيش أي يفط ظاهرة في الصورة,السور الحديد مفرغ ومدرج ومش حتة واحدة,اه الطريق نضيف ومرصوف وخطوطه واضحة,False,True,False,False,False
8f90a145bea7028a0e7227598cab0ddb,Egyptian,"الصورة لشاب أسمر وشعره أسود يرتدي قميص أبيض، ومتجه بجسده ونظراته الشاردة ناحية يمين الصورة. الشاب هذا ملامح وجهه توحي أنه مصري.
أما الخلفية فيظهر فيها سطح النيل الهادئ، وفي منتصف النيل 2 من المراكب الشراعية ومركب صغير وبعض السفن. وعلى شاطئ النيل من الناحية الأخرى تظهر بعض الأشجار ومئذنة جامع، والسماء أيضا واضحة وتشغل مساحة كبيرة من الصورة.","الصورة لشاب أسمر وشعره أسود لابس تيشيرت أبيض، ومتجه بجسمه ونظراته السرحانة ناحية يمين الصورة. الشاب ده ملامح وشه بتقول إنه مصري.
أما الخلفية فبيظهر فيها سطح النيل الرايق، وفي نص النيل 2 من المراكب الشراعية وفلوكة وبعض السفن. وعلى شط النيل من الناحية التانية بتظهر بعض الأشجار ومدنة جامع، والسما كمان واضحة وآخدة مساحة كبيرة من الصورة.",هل الشاب الاسمر قريب اوي من الصورة باين بنص جسمه بس؟,متوسط عمر الشاب ده اد ايه تقريبا؟,الصورة كانت بالنهار ولا بالليل؟,مدنة الجامع من المأذن العالية او الاثرية؟,مفيش اي مباني ظاهرة في الصورة ؟,الشاب الأسمر قريب أوي من الصورة باين لحد كتافه بس,متوسط عمر الشاب تقريبا في العشرينات,الصورة كانت بالنهار لكن السما لونها أبيض مايل للرمادي, المدنة بعيدة جدا والتفاصيل مش واضحة,في مباني بعيدة جدا في خلفية الصورة مش ظاهر تفاصيلها,False,False,False,True,False
83d266afea58197d7b305575086c0276,Egyptian,"امرأة في الأربعينيات من عمرها، شعرها فاتح قليلاً، تقف على منصة صغيرة مربعة من الخشب البني. أمامها ميكروفونات وزجاجة مياه ولوحة مكتوب عليها ""ويكيمانيا 2088"" بالإضافة إلى بعض الكلمات الأخرى وشعار باللون الأزرق على خلفية برتقالية. المنصة موضوعة على أرضية مفروشة بغطاء من اللون الأحمر الشمواه. على اليسار يوجد زرع صناعي، وعلى اليمين رجل واقف ممسكاً بورقة بيضاء، وفي الخلف جدار يحمل نفس اللوحة التي أمام المرأة. بجانب الرجل يوجد سلم يؤدي إلى المنصة التي يقف عليها.",صورت لست أربعينية شعرها فاتح شوية واقفة على حاجة زي منصة صغيرة مربعة خشب بني وقدامها ميكروفونات وإزازة مياه ولوحة مكتوب عليها ويكيمانيا 2088  وكلام تاني ولوجو أزرق في أورانج. المنصة دي على أرضية مفروشة حاجة لونها أحمر شمواه كدا. على الشمال في زرع صناعي وعلى اليمين في راجل واقف ماسك ورقة بيضا ووراه حيطة محطوط عليها نفس اللوحة الأولى. جنب الراجل في سلم اللي بيطلع للمنصة اللي هو واقف عليها.,الصورة متصورة بالليل ولا بالنهار؟,اللوجو ده مكتوب عليه حاجة ؟,فى حد ظاهر بيصور الموقف ده ؟,الراجل إلى ماسك ورقة بيضة مواصفاته إيه ؟,تعبيرات وش الست الى على المنصة إيه ؟, الصورة متصورة في مكان مقفول مش باين فيه الشمس ولا الوقت في اليوم,اللوجو مكتوب عليه ويكيمانيا 2008 بالعربي وبالانجليزي,لا مفيش حد ظاهر بيصور الموقف دا,راجل في التلاتينات تقريبا وأبيض ولابس قميص رمادي نص كم وبنطلون أسود ومبتسم وشعره أسود,الست على المنصة مبتسمة أوي وبتشاور لحد وشكلها سعيد ومتحمس,True,False,False,False,False
18ccc19b004e5cfef89e42b1a2180db5,Egyptian,الصورة خلال النهار والسما صافية، لكن الشمس ليست قوية جداً، وقد تكون الصورة بعد العصر. يظهر في الصورة مجموعة من الشباب، من بنات وأولاد، متواجدين بشكل عشوائي على الشاطئ. أغلب البنات يرتدين قمصان بدون ازرار بيضاء وبناطيل سوداء أو بناطيل جينز، بينما الأولاد يرتدون بناطيل سوداء وقمصان بدون ازرار بيضاء وطرح حمراء، ويقومون برفع علم مصر. في مقدمة الصورة، يظهر مجموعة من الشباب والبنات جالسين على الرمل، وأول بنت منهم تمسك بالعلم. خلفهم، هناك شباب وبنات واقفون ومعهم علم كبير، وأغلبهم يرفعون أيديهم للأعلى. كما يظهر عمودان إنارة لونهما أسود في وسط الشباب. على الجانب الأيسر، يظهر جزء من مياه الشاطئ.,الصورة بالنهار والسما صافية بس الشمس مش قوية أوى ممكن تكون الصورة بعد العصر . الصورة لمجموعة من الشباب بنات وأولاد متواجدين بشكل عشوائى على شاطئ . أغلب البنات لابسين تيشرتات بيضة وبناطيل سودا أو بناطيل جينز والولاد لابسين بناطيل سودا وتيشرتات بيضة وطرح حمرا ورافعين علم مصر . فى أول الصوره ظاهر مجموعة من الشباب والبنات  قاعدين على الرمل وأول بنت منهم ماسكه العلم ووراهم شباب وبنات واقفين ومعاهم علم كبير  وأغلبهم رافع إيديه لفوق ومعاهم . ظاهرين عمودين نور لونهم إسود فى وسط الشباب . على الشمال باين جزء من ماية الشاطئ,مياة البحر صافية وزرقاء ولا ايه؟,عدد الأشخاص اللي في الصورة حوالي اد ايه؟,الرمل بتاع البحر دا نضيف ولا لا؟,تعابير وش أغلب الناس اللي في الصورة عاملة ازاي؟,الشباب دي لبسها رياضي وشكلهم محترفين ولا ايه؟, مش باين من البحر غير الجزء الأبيض اللي بيكون على الرمل,عدد الأشخاص في الصورة كتير حوالي 100 شخص,اه الرمل بتاع البحر نضيف,الناس اللي واقفة تتصور مبسوطة وبتضحك، انما اللي في الخلفية مش واضحين,لا الشباب لبسها مش رياضي عشان لابسين بنطلونات جينز,True,False,False,False,False
70b4fb12ff8df12d9f61e2495a1cc53c,Egyptian,إمرأة بدوية تحمل طفلاً رضيعاً، ملفوف في قماشة زاهية الألوان عليها زخرف تراثي، وحوله غطاءٌ من الصوف، ينظر للبعيد محاطاً بذراع أمه، التي لايبدو منها في الصورة على اليسار إلا نصف وجهه الأيمن وكتف وذراع.,ست بدوية شايلة نونو صغير، الطفل ملفوف في قماشة عليها زخارف تراثية وألوانها زاهية، وملفوف حواليه بطانية، عينيه باصة لبعيد، وأمه محاوطاه بإيدها وباين منها بروفايل الوش والكتف والدراع على شمال الصورة.,الصورة متاخدة في مكان شكله ايه؟,ملامح وش الست دي عاملة ازاي؟,ايه المميز في الصورة يخلينا نقول ان الست بدوية؟,الست دي واقفة ولا قاعدة؟,الست اللي في الصورة لابسة ايه؟, الصورة قريبة جدا من وش الطفل وتفاصيل المكان مش باينة,مش باين غير شفايفها ومناخيرها، وهي لونها قمحي فاتح وشفايفها رفيعة ومناخيرها مش كبيرة ومش حاطة مكياج,شكل التطريز على القماش اللي ملفوف بيه الطفل الصغير بدوي, الصورة قريبة جدا من الطفل مش موضحة الست واقفة ولا قاعدة,لابسه حاجة رمادي بكم وطرحة سودا على حرفها تطريز بسيط,True,False,False,True,False
