id,dialect,description,description_dialect,question1,question2,question3,question4,question5,answer1,answer2,answer3,answer4,answer5,no_answer1,no_answer2,no_answer3,no_answer4,no_answer5
84a29eb14a6066fc19e6aa31280e2321,Moroccan,تُظهر الصورة شارعاً مكتظاً بالمحلات التجارية التي تعرض مختلف أنواع الملابس. يسير الناس في الشارع يتجولون بين المحلات. تدل المباني البيضاء على قدمها الزمني. ورغم الغيوم الكثيفة في السماء، يشير لباس المارة الصيفي إلى ارتفاع درجة الحرارة. ومن خلال هذه التفاصيل، يتضح أن الصورة التُقطت في أحد الأحياء الشعبية بمدينة مغربية.,فالصورة كيبان واحد الشارع فيه بزاف ديال المحالات ديال الحوايج . الناس دايزين من الشارع و كيدوروا فالحوانت. الديور المصبوغة بالبيض كتبان على أنها ديور قديمة شوية. فالسما كاينين لغيام كتار و لكن الجو كيبان سخون من الحوايج ديال الصيف للي لابسين الناس. من خلال هاد التفاصيل كاملين كتبان بللي هاد الصورة تخادت من شي حي شعبي فشي مدينة مغربية.,واش كيانو الماركات ديال هاد الحوانت؟,واش الناس كيبانو انهم كيتقداو ولا غير دايزين؟,واش كاين اقبال على هاد الحوانت؟,واش الشارع كبير ولا صغير؟,شنو لابسين هاد الناس لي فالصورة؟,لا الحوانت هما حوانت تقليديه ما فيهمش الأسماء ديال الماركات. ,نعم كاينين بزوج :  ناس كايتقداو و كاينين ناس دايزين. ,نعم كاين اقبال كبير على هاد الحوانت حيت كايكونو نازلين فالثمن. , ماكايبانش الحجم ديال الشارع كامل فالصورة. ,العيالات لابسين جلالب والرجال الاغلبيتهم لابسين سراول وتريكوات نص كم. ,False,False,False,True,False
8e451f860aba50e690109d96af223bf3,Moroccan,"تظهر في الصورة مجموعة من النساء جالسات على الكراسي ومتباعدات عن بعضهن. يجلسن في قاعة ويستمعن لاثنين من الرجال الواقفين أمامهن. المشهد يبدو وكأنه جزء من حملة توعية. جميع الحاضرين في القاعة يرتدون الكمامات، وهو ما يشير إلى أن الصورة قد تكون التقطت خلال فترة جائحة كورونا. على الجدار المقابل، توجد ملصقات ذات صلة بالموضوع الذي يشرحه الرجال الواقفون.






",كيبان في الصورة مجموعة من النساء جالسين على الكراسا ومبعدين على بعضم. كاينين فواحد القاعة كيسمعو لجوج دالرجال وقفين. كيبان بحال شي حملة ديال التوعية. لي في القاعة كلشي دايرين الماسك، شي لي كيبين أن الصورة تقدر تكون في الفترة ديال كورونا. على الحيط المقابل كاين ملصقات عندها علاقة بشي لي كيشرحوه الرجال لي واقفين. ,واش كيحتارمو هاد الناس الشروط لي كانت فكورونا؟,واش كاين شي حاجة كدل على موضوع هاد الحملة التوعوية؟,شنو كاين فهاد الملصقات لي فالحيط؟,كيفاش كتبان الهيئة دهاد الرجال لي واقفين كيشرحو؟,كيفاش كتبان الحالة ديال البلاصة واش عادية ولا شي حاجة أخرى؟,نعم كيحترموا الشروط اللي كانت في كورونا الكراسة مباعدين والناس دايرين كمامات. ,لا ما كاينه حتى شي حاجه كاتدل على الموضوع ديال الحملة التوعوية كاينين منشورات لاصقين في الحيط ولكن غير واضحين. , هاد الملصقات غير واضحة فالصورة. ,الرجال اللي واقفين كايشرحو هما رجال متوسطين في السن دايرين كمامات ولابسين لباس موحد. ,هذه البلاصه اللي هما فيها كيبان بحال شي قسم مبني في الباديه غير مصلوح. ,False,False,True,False,False
e388841d54504581a8d855d9578c1538,Moroccan,هذه الصورة تمثل منظر لمدينة ما، تحتوي على العديد من المنازل المحاطة بالخضرة وأشجار النخيل بكثرة، والسماء صافية وفيها بعض الغيوم. يظهر في الخلفية مئذنة مسجد وبعض الأطباق اللاقطة على أسطح المنازل.,هاد الصورة فيها واحد المنظر ديال شي مدينة ، فيها بزاف ديال الديور دايرين بيهم الخضورة و النخل كثير، والسماء صافية وفيها شوي ديال الغمام. كاتبان واحد الصومعة ديال شي جامع اللور و البارابولات فالسطوح ديال الديور. ,شنو هو المنظر لي غالب فهاد الصورة؟,كيفاش كبانو هاد الديور لي فالصورة؟,واش الصومة معلمة كتبيلنا المدينة لي تخادت فيها الصورة؟,شنو لي كيميز هاد الصورة؟,واش سطوحة كاملين كنجبرو فيهم بالابرابولات ولا كاينين استثناءات؟,المنظر اللي غالب في هذه الصوره هو منظر البنايات الكثيره والشجر الكتير اللي داير بهم. ,الديور اللي في الصوره كايبانوا مصبوغين باللون الابيض ونقيين. ,لا هذا الصومعه بعيده ما كاتبينش اينا مدينه تخادت فيها الصوره. ,اللي كايميز هذه الصوره هما الاشجار الكثيره اللي باللون الاخضر والنخيل اللي كايعطي واحد المنظر زوين بزاف. , كاينين ديور مدرقين بالاشجار ما كايبانوش واش فيهم بارابول ولا لا. ,False,False,False,False,True
25266822d5f51997dbbd56d3c972f5c9,Moroccan,تُظهر هذه الصورة رجلاً يحمل رزمة في يده، يدخل إلى مبنى يظهر من لافتته العلوية أنه مركز للبريد. ويتضح من ملابس الرجل والصور المعلقة على زجاج المحل أن هذه الصورة التُقطت في أحد مراكز البريد بالمغرب.,"هاد الصورة كيبان فيها واحد الراجل هاز رزمة فيديه , الراجل داخل من واحد الباب لي كايبان من الكتابة للي لفوق على أنه مركز ديال البريد . من خلال تحليل داكشي لي لابس السيد للي في الصورة و التصاور للي ملصقين في الزاج ديال المحال , كيتضح بللي الصورة من  شي مركز ديال البريد فالمغرب .",شناهو الحجم ديال هاد الرزمة؟,ديالاش التصاور لي ملصقين فالزاج؟,شنو لابس الراجل لي فالصورة؟,شنو ممكن تكون علاقة الرجل بالمكان لي داخليه؟,شنو ممكن داك الرجل يكون هاز فالرزمة؟,في الصورة كاينين جوج رزمات صغار , لااعرف ماكيبانوش واضحين في الصورة ,لابس فوقية ودجاكيط خفبفة وسبارديل, من خلال الصورة ماكيبانش شنو هو الغرض ديالوا , ميمكنش نعرف الجواب حيت رزمات مسدودين,False,True,False,True,True
149c85088d49088a347575cee734d2c1,Moroccan,تُبرز هذه الصورة لوحة طبيعية خلابة تجمع بين خضرة الشجر وشموخ الجبال،  وتضيف الصخور البارزة في يسار الصورة لمسة فنية فريدة تزيد المشهد جمالاً. من المحتمل أن يكون هذا المكان هو وادي دادس، ذلك المعلم  الشهير في جبال الأطلس الكبير بالمغرب.,"فهاد الصورة كيبان لينا واحد المنظر زوين بزاف كيجمع بين الخضورية ديال الشجر و الشموخ ديال الجبال , و اللي واعر بزاف هما الحجر لي فليسر ديال الصورة اللي عاطيين واحد التحفة فنية لهاد المنظر. هاد البلاصة ممكن تكون واد دادس ديك البلاصة المشهورة فالنواحي ديال الأطلس الكبير فالمغرب.",شناهوما الأنشطة لي ممكن نديرو فهاد الجبل؟,واش الطبيعة كتبان ناشفة ولا ماشي ناشفة؟,شنو لي كيميز هاد الحجر حتى يبانو تحفة فنية؟,واش ممكن يكونو ناس عايشين قراب من هاد المنطقة؟,واش كيبان شي واد دايز ولا محيط بهاد الصورة؟, من خلال الصورة ما كايبانش شنو الانشطه اللي ممكن نديروا. ,كاينه جهة فيها الخضوره بزاف وكاينه جهة اخرى اللي كاتبان فيها غير التراب وناشفة. ,اللي كايبان مميز في هذا الحجر هو الشكل الفني ديالهم. ,نعم ممكن يكونوا ناس عايشين قريب لهذه المنطقه حيت كايبانوا الديور تما. ,ما كايبان حتى شي واد دايز او محيط فهاد الصورة. ,True,False,False,False,False
08a78551b21d0dc51bdf103490aaf50a,Moroccan,في هذه الصورة توجد سلة صغيرة من القصب تحتوي على رمانتين، إحداهما كبيرة ومفتوحة قليلاً وتظهر منها الحبات الحمراء، والأخرى صغيرة وما زالت مغلقة. الرمانة الكبيرة تبدو قديمة وجافة قليلا. ,في هاد الصورة كاين واحد السلة صغيرة ديال القصب وفيها جوج ديال الرمانات، وحدة كبيرة محلولة شوية وباينين منها الحبات الحمرين ديال الرمان ، والثانية صغيرة ومازال مسدودة. الرمان الكبير باين عليه قديم وناشف شوية. ,هاد السلة لي فصورة  فين محطوطة؟,واش الرمانة المحلولة كيبان بلي كلا منها شي حد؟,واش الرمانة المسدودة كيبان فيها الجودة؟,علاش فنضرك غيكون الرمان الكبير ناشف وقديم؟,شنو كيبان فالصورة من غير الرمان و السلة؟, في الصورة مابينش فين محطوطين ,لا كتبان فقط محلولة شوية , مايمنكش نعرف من خلال الصورة,بلعكس كتبان رمانة عادية وطايبة,مكاينة حتى حاجة خرى فقط الرمان,True,False,True,False,False
1fd0b7c297ac85c6a446777e0449b15f,Moroccan,في هذه الصورة تظهر ساحة كبيرة وواسعة، وفيها أشجار و نخيل كبيرة. توجد بناية من القرميد على الجهة اليسرى، وبعيدًا قليلًا يوجد بعض الأشخاص مجتمعين في وسط الساحة. السماء زرقاء وصافية، والمكان يبدو هادئًا ومفتوحًا على الطبيعة. أرضية الساحة مبلطة جيدًا وهناك بعض الأماكن التي تحتوي على الحصى.,فهاد الصورة كتبان واحد الساحة كبيرة وواسعة، وفيها شجر و نخل كبير. كاينة بناية من القرموض على الجهة اليسرى، وبعيد شوية كاينين شي ناس مجموعين فوسط الساحة. السماء زرقاء صافية، والبلاصة كتبان أنه هادئة ومفتوحة على الطبيعة. الأرضية ديال الساحة مزلجة مزيات و كاين شي بلايص فيهم الحجر المزرار. ,شناهي دلالة الحجار المزرار لي كاين فالصورة؟,ديالاش هاد الساحة الكبيرة لي كتبان فالصورة؟,ديالاش هاد البناية لي كاينة على ليسر؟,شكيديرو هادوك الناس لي مجموعين؟,شنو لي كيميز هاد الصورة؟,الحجر المزرار اللي كاين في الصوره كيتحطوا فيه بعض الديكورات وماشي ممر كايدوزوا منه الناس. , من خلال الصوره ما كايبانش اينا ساحة كاتبان في الصورة. ,بنايه فيها رايه المغرب تقدر تكون شي مؤسسه او مكتبه او جامعه ما كايبانش بالضبط في الصوره ديالاش هاد البناية. ,هذوك الناس اللي مجموعين واقفين جماعات كيهضروا فيما بيناتهم. ,اللي كايميز هاد الصورة  انه كايغلب عليها طابع الهدوء وان هاد الساحة اللي في الصورة  كاتبان نقيه بزاف. ,False,True,False,False,False
bb206dcf26453d5ba7a5fec564bdfcb8,Moroccan,في الصورة يظهر جزء من مدينة ساحلية في المغرب. في المقدمة يظهر المسجد والمنازل وبعض الأشجار ، ومن بعيد يظهر البحر. السماء تبدو صافية، والصورة تم التقاطها وقت غروب الشمس., في الصورة كيبان وأحد الجزء من شي  مدينة ساحلية في المغرب. في الأول كيبان المسجد والديور وشي أشجار ومن بعيد كيبان البحر، السماء كتبان صافية والصورة تاخدات في وقت غروب الشمس.,شنو هوما هاد الأجزاء الساحلية لي كيبانو؟,واش المسجد و البنايات كيبانو جدادين ولا قدامين؟,واش كاينين الناس فهاد الصورة؟,ديالاش هاد الأشجار لي كيبانو فالصورة؟,واش المسجد معلمة كتدل على المدينة لي تخادت فيها الصورة؟, كيبان فقط جزء من ها المدينة, من خلال الصورة يصعب تحديد واش قدام او جداد,لا ماكيبانوش الناس في الصورة, صعيب معرفة نوع ديال الأشجار,جميع مساجد المغرب عندهم نفس الهندسة المعمارية,True,True,False,True,False
9c54d15ec2bab65eb56a615955b0ed25,Moroccan,تلتقط هذه الصورة ثلاثة أشخاص: رجل وامرأتان. الرجل يرتدي نظارات شمسية ومن المحتمل أن يكون زوج المرأة المتواجدة في الوسط، وأن المرأة الأخرى هي والدة أحدهما. يبدو أنهم يتأملون في شيئ ما أمامهم. وفي يسار الصورة، تبرز سقاية مزينة بالزليج المغربي.,فالصورة كيبانوا ثلاتة ديال الناس، رجل و جوج عيالات، الراجل لابس النضادر ديال الشمس وممكن يكون مزوج بالمراة للي فالوسط و المراة الأخرى للي فالطرف تكون الأم ديال واحد فيهوم. كيبان على أنهم كيتفرجوا فشي حاجة قدامهم. فليصر ديال الصورة كاينة واحد السقاية مزوقة بالزليج المغربي. ,شنو الدلالة ديال أنهم مزوجين؟,شنو لابسين هاد العيالات و الرجل؟,واش الصورة فيها انطباع تقليدي؟,واش السقاية فيها الما ولا يابسة؟,واش كيبان فاش كيتفرجو فالصورة؟, ماكايبانش فالصورة صلة القرابة بيناتهم. ,"واحدة لابسة كسوة طويلة بالكحل و البيض و حجاب و فوق منو طربوش أبيض كبير.
المرأة للثانية لابسة قاميجة كارو بالبيض و الكحل وسروال دجين و حجاب رمادي.
و الراجل لابس تريكو نص كم فالصومو و نظاظر كحلين و سروال دجين . ",نعم من هلال السقاية التقليدية اللي حداهم. , السقاية مصور فيها غير النص ماباينش واش عامرة و لا خاوية. ,لا ماكايبانش فاش كايشوفو فالصورة. ,True,False,False,True,False
1b9304cd0d11a3b306c4f71bc60f3d53,Moroccan,في هذه الصورة يوجد رجل مسن جالس أمام حائط في الشارع وبجانبه صندوق كرتوني، يرتدي جلبابًا أسود وفوقها سترة زرقاء، وعلى رأسه قبعة بيضاء. بجانب الرجل توجد دراجة، وعلى الأرض يجلس قط نائم. أمامه يوجد كرسي خشبي قديم مغطى بقطعة قماش، وعلى الأرض أمام الدراجة يوجد دلو بلاستيكي صغير. الرجل ينضر إلى شيء في الجانب، ويمسك بيديه سكينا أو أداة ربما يستعملها مع قطعة قماش خضراء موضوعة على رجليه.,فهاد الصورة كاين راجل كبير فالعمر جالس على حيط فالزنقة حدا كارتونة ولابس جلابة كحلا و فوق منها جاكيتة زرقة و داير كاسكيطة بيضا فوق راسو. حدا الراجل كاينة بيكالا ومش جالس على الأرض ناعس، كاين قدامو كرسي ديال العود قديم مغطى بطرف ديال التوب، وعلى الأرض قدام البيكالا كاينة شي سطل ديال البلاستيك صغير. الراجل كيشوف فشي حاجة فالجنب، و شاد فايديه شي حاجة بحال شي موس ولا شي أداة ويقدر يكون خدام على واحد التوب خضر حاطو على رجليه. ,واش هاد الرجل كيبان على انه كيبيع شي حاجة؟,ديالمن داك البيكالا لي فالصورة؟,شناهو اللون ديال المش لي ناعس؟,فين كاين هاد الرجل لي فالصورة؟,واش كاين ناس أخرين فهاد البلاصة؟,لا ماكايباش واش كيبيع شي حاجة حيت ما حداه حتى سلعة معروضة. , ماباينش فالصورة ديال من البيكالا. ,المش اللي ناعس ابيض و فيه الكحل. ,هاد الراجل كاين فالزنقة متكي عللى شي حيط ديال شي دربة. ,لا ماكايبان تاحد اخر فهاد الصورة. ,False,True,False,False,False
a00a2fc36b05fd34dbc51970ee89277c,Moroccan,"في هذه الصورة نرى رجلين كبيرين في السن. الرجل الأول يرتدي جلباب أزرق مع القليل من اللون الذهبي وسلهام أسود وعقدة رأس أبيض ويضرب على بندير في الأسود, الرجل الثاني يرتدي جلابة بيضاء مخططة بالأزرق الفاتح و عقدة رأس بيضاء وهو أيضا يضرب على بندير أسود.","فهاد التصويرة كنشوفو جوج رجال كبارين فالسن. الرجل اللول لابس جلابة فالزرق وشوية ديال الذهبي وسلهام فالكحل ورزيزة فالبيض وكيضرب البندير فاللكحل, والرجل الثاني لابس جلابة فالبيض مخططة بالزرق فاتح وزيزة بيضا وحتا هو هاز فيديه بندير كحل.",شحال يكون العمر ديال هاد جوج رجال ؟,واش كاينين شي ناس أخرين معاهم ؟,واش هاد الرجال جزء من شي مجموعة موسيقية ؟,علاش الراجل الثاني ملابسش السلهام ؟ ,واش هاد الرجال كاينين داخل شي دار ولا على برا ؟,الراجل الاول يكون فالخمسينات و الثاني الثلاثينات او الاربعينات. ,لا كاينين غير هوما بجوج. ,نعم هوما مع مجموعة موسيقية. ,السلهام لابسو الراجل الكبير حيت هو الرايس ديالهم. , ماباينش واش الداخل او برا. ,False,False,False,False,True
6c03006d09b4ea3a398eca8c4c99cf8e,Moroccan,في الصورة توجد مجموعة من الشباب واقفين أمام جدار ملوّن برسومات وألوان مختلفة. يظهرون جميعًا سعداء ويضحكون، هناك من يرفع يديه لتحية الكاميرا، وهناك من ينظر إلى صديقه أو صديقته. يبدو وكأنه لقاء شبابي، الأشخاص يرتدون ملابس متنوعة ويعلقون بطاقات تعريفية على صدورهم، وهناك فتاتان جالستان في المقدمة تبدوان سعيدتين وتضحكان.,فالصورة كاينين مجموعة ديال الشباب واقفين قدام حيط ملون برسومات و الوان مختالفة . كيبانو كاملين فرحانين وكيضحكو، كين اللي رافع يديه وكيحيي الكاميرا، وكين اللي كايشوف فصاحبو أو صاحبتو. كيبان بحال شي لقاء شبابي، الناس لابسين لباس مختلف و معلقين بادجات على صدرهم، وكاينين منهم زوج بنات فاعدين القدام فرحانين وضاحكين. ,شنو كتعني ديك الرسومات و الألوان لي فالحيط ؟,شنو السب لي خلا هاد المجموعة دبال الشباب فرحانين وكيضحكو ؟,علاش هاد الشباب مجموعين فها البلاصة ؟,علاش معلقين بادجات على صدرهم ؟,واش كيبانو فالصورة ناس آخرين بلا هاد الشباب ؟,الرسومات اللي فالحيط بحال شي اوراق اشجار وسط منهم كتبة مدرقينها دوك الناس اللي واقفين. ,هاد الناس كيضحكو مع الكاميرا باش يتصورو. ,باينة انهم فشي حدث مرتبط بالخدمة ديالهوم او شي جمعية . , ماباينش فالصورة علاش معلقين بادجات. ,لا ماكايبان تاحد من غير هاد الشباب. ,False,False,False,True,False
9ae486af93f4ec8e23cfe4a13c2811fb,Moroccan,في هذه الصورة يظهر منظر من الأعلى لمدينة الدار البيضاء، حيث توجد العديد من العمارات والمنازل المتلاصقة. في الخلفية، يظهر مسجد الحسن الثاني بالقرب من البحر. الأجواء تبدو هادئة والسماء صافية مع غروب الشمس.,في هاد الصورة كيبان منظر من الفوق على مدينة الدار البيضاء، كينين بزاف ديال العمارات والديور الملاصقين . فاللور، كيبان مسجد الحسن الثاني ، وقريب من البحر. الأجواء باينا هادئة والسماء صافية مع غروب الشمس. ,شنو لي خلى المسجد الثاني يكون معلمة كتدل على الدار البيضاء؟,واش العمارات سكانية ولا ادارية؟,كيفاش كتبان الحالة ديال البحر؟,واش كيبانو شي ناس فهاد الصورة؟,العمارات كيبانو بنايات جديدة ولا قديمة؟, مسجد الحسن الثاني معروف كاين فالدار البيضاء. ,العمارات من بعيد ماكايبانش الاصل ديالهوم واش سكانية او ادارية. ,البحر من بعيد كايبان هادئ. ,لا ماكايبانوش باللي كاينين ناس فالصورة. ,العمارات مخلطين فيهم القديم و الجديد. ,True,False,False,False,False
